{
  "schemaVersion": "1.2",
  "caseId": "kimi-k3-000-011-test",
  "durationInFrames": 330,
  "motions": [
    {
      "id": "overlay-camera-pullback",
      "targetId": "@camera",
      "phase": "camera",
      "firstVisible": 0,
      "settledFrame": 82,
      "endFrame": 103,
      "transform": {
        "scaleX": {
          "keyframes": [
            {
              "frame": 8,
              "value": 1.325
            },
            {
              "frame": 82,
              "value": 1
            }
          ],
          "interpolation": "bezier",
          "bezier": [
            0.203,
            0.398,
            0.009,
            1
          ]
        },
        "scaleY": {
          "keyframes": [
            {
              "frame": 8,
              "value": 1.325
            },
            {
              "frame": 82,
              "value": 1
            }
          ],
          "interpolation": "bezier",
          "bezier": [
            0.203,
            0.398,
            0.009,
            1
          ]
        }
      },
      "evidence": {
        "type": "observed",
        "detail": "evidence/motion/overlay-forensics.md：显示器与上字纹理共同测量；0–8保持，8–82收束。",
        "frames": [
          0,
          82,
          103
        ]
      },
      "confidence": "high"
    },
    {
      "id": "earth-character-reveal",
      "targetId": "earth-title",
      "phase": "entrance",
      "firstVisible": 1,
      "settledFrame": 14,
      "endFrame": 103,
      "textAnimation": {
        "preset": "ghost-drop-in",
        "startFrame": 1,
        "endFrame": 14,
        "seed": 23,
        "staggerFrames": 3.5,
        "stretchY": 1,
        "distancePx": 25,
        "blurPx": 1,
        "direction": "bottom-to-top",
        "ghostLayers": 1,
        "ghostOffsetPx": 0,
        "ghostOpacity": 0
      },
      "evidence": {
        "type": "observed",
        "detail": "地/球/上首次可见约1/4/8；逐字短上收约25px，无可靠多层残影。",
        "frames": [
          1,
          14,
          103
        ]
      },
      "confidence": "high"
    },
    {
      "id": "parameter-label-soft-entry",
      "targetId": "parameter-label",
      "phase": "entrance",
      "firstVisible": 12,
      "settledFrame": 33,
      "endFrame": 103,
      "transform": {
        "opacity": {
          "keyframes": [
            {
              "frame": 12,
              "value": 0
            },
            {
              "frame": 33,
              "value": 1
            }
          ],
          "interpolation": "linear"
        },
        "blurPx": {
          "keyframes": [
            {
              "frame": 12,
              "value": 3
            },
            {
              "frame": 33,
              "value": 0
            }
          ],
          "interpolation": "bezier",
          "bezier": [
            0.2,
            0.6,
            0.3,
            1
          ]
        },
        "y": {
          "keyframes": [
            {
              "frame": 12,
              "value": -20
            },
            {
              "frame": 30,
              "value": 0
            }
          ],
          "interpolation": "bezier",
          "bezier": [
            0.2,
            0.6,
            0.3,
            1
          ]
        }
      },
      "evidence": {
        "type": "observed",
        "detail": "参数量整段低透明度显影；轻微下移，共享镜头缩小。",
        "frames": [
          12,
          33,
          103
        ]
      },
      "confidence": "high"
    },
    {
      "id": "emphasis-da-soft-entry",
      "targetId": "emphasis-da",
      "phase": "entrance",
      "firstVisible": 11,
      "settledFrame": 33,
      "endFrame": 103,
      "transform": {
        "opacity": {
          "keyframes": [
            {
              "frame": 10,
              "value": 0
            },
            {
              "frame": 33,
              "value": 1
            }
          ],
          "interpolation": "linear"
        },
        "blurPx": {
          "keyframes": [
            {
              "frame": 11,
              "value": 2
            },
            {
              "frame": 30,
              "value": 0
            }
          ],
          "interpolation": "bezier",
          "bezier": [
            0.2,
            0.6,
            0.3,
            1
          ]
        },
        "y": {
          "keyframes": [
            {
              "frame": 11,
              "value": -18
            },
            {
              "frame": 26,
              "value": 0
            }
          ],
          "interpolation": "bezier",
          "bezier": [
            0.2,
            0.6,
            0.3,
            1
          ]
        }
      },
      "evidence": {
        "type": "observed",
        "detail": "大字独立近线性低透明度显影；保持青蓝色。",
        "frames": [
          11,
          33,
          103
        ]
      },
      "confidence": "high"
    },
    {
      "id": "open-source-rise",
      "targetId": "open-source-title",
      "phase": "entrance",
      "firstVisible": 32,
      "settledFrame": 66,
      "endFrame": 103,
      "transform": {
        "y": {
          "keyframes": [
            {
              "frame": 32,
              "value": 55.5
            },
            {
              "frame": 66,
              "value": 0
            }
          ],
          "interpolation": "bezier",
          "bezier": [
            0.117,
            0.539,
            0.425,
            1
          ]
        }
      },
      "evidence": {
        "type": "observed",
        "detail": "四字整组在32已可见，camera校正后y55.5→0；非逐字。",
        "frames": [
          32,
          66,
          103
        ]
      },
      "confidence": "high"
    },
    {
      "id": "parameter-incoming-dissolve",
      "targetId": "@transition",
      "phase": "transition",
      "firstVisible": 92,
      "settledFrame": 103,
      "endFrame": 103,
      "transform": {
        "opacity": {
          "keyframes": [
            {
              "frame": 92,
              "value": 0
            },
            {
              "frame": 103,
              "value": 1
            }
          ],
          "interpolation": "bezier",
          "bezier": [
            0.42,
            0,
            0.58,
            1
          ]
        }
      },
      "evidence": {
        "type": "observed",
        "detail": "旧场92开始淡出，95约.77/98约.34/101约.02，103消失；A-roll为白色。",
        "frames": [
          92,
          103,
          103
        ]
      },
      "confidence": "medium"
    },
    {
      "id": "parameter-camera-pullback",
      "targetId": "@camera",
      "phase": "camera",
      "firstVisible": 95,
      "settledFrame": 171,
      "endFrame": 171,
      "transform": {
        "scaleX": {
          "keyframes": [
            {
              "frame": 99,
              "value": 1.643677712076979
            },
            {
              "frame": 171,
              "value": 0.8990115291055184
            }
          ],
          "interpolation": "bezier",
          "bezier": [
            0.234,
            0.494,
            0.992,
            0.824
          ]
        },
        "scaleY": {
          "keyframes": [
            {
              "frame": 99,
              "value": 1.643677712076979
            },
            {
              "frame": 171,
              "value": 0.8990115291055184
            }
          ],
          "interpolation": "bezier",
          "bezier": [
            0.234,
            0.494,
            0.992,
            0.824
          ]
        }
      },
      "evidence": {
        "type": "observed",
        "detail": "evidence/motion/parameter-forensics.md；164仅为布局采样，持续缩小至171；单曲线拟合。",
        "frames": [
          95,
          171,
          171
        ]
      },
      "confidence": "medium"
    },
    {
      "id": "number-stagger-converge",
      "targetId": "parameter-main-number",
      "phase": "entrance",
      "firstVisible": 99,
      "settledFrame": 124,
      "endFrame": 171,
      "textAnimation": {
        "preset": "ghost-drop-in",
        "startFrame": 83,
        "endFrame": 124,
        "seed": 23,
        "staggerFrames": 4,
        "stretchY": 3.5,
        "distancePx": 0,
        "blurPx": 2,
        "direction": "bottom-to-top",
        "ghostLayers": 1,
        "ghostOffsetPx": 0,
        "ghostOpacity": 0
      },
      "effects": {
        "brightness": {
          "keyframes": [
            {
              "frame": 99,
              "value": 0.45
            },
            {
              "frame": 124,
              "value": 1
            }
          ],
          "interpolation": "bezier",
          "bezier": [
            0.2,
            0.6,
            0.3,
            1
          ]
        }
      },
      "evidence": {
        "type": "observed",
        "detail": "五位数字依次纵向收束，约108/112/116/120/124落定；不计数，不添加detached ghost。",
        "frames": [
          99,
          124,
          171
        ]
      },
      "confidence": "medium"
    },
    {
      "id": "billion-converge",
      "targetId": "parameter-billion-unit",
      "phase": "entrance",
      "firstVisible": 115,
      "settledFrame": 132,
      "endFrame": 171,
      "textAnimation": {
        "preset": "ghost-drop-in",
        "startFrame": 115,
        "endFrame": 132,
        "seed": 23,
        "staggerFrames": 0,
        "stretchY": 3.4,
        "distancePx": 0,
        "blurPx": 3,
        "direction": "bottom-to-top",
        "ghostLayers": 1,
        "ghostOffsetPx": 0,
        "ghostOpacity": 0
      },
      "transform": {
        "scaleX": {
          "keyframes": [
            {
              "frame": 115,
              "value": 1.14
            },
            {
              "frame": 132,
              "value": 1
            }
          ],
          "interpolation": "bezier",
          "bezier": [
            0.2,
            0.6,
            0.3,
            1
          ]
        }
      },
      "evidence": {
        "type": "observed",